"Mann soll statt dieses den gewinn der grossfirmen nicht nur besteuern in das land wo die sitzung haben, aber in das land wo das gewinn realisiert ist. So solltle den pahr 100 millionen (oder was dan auch) gewinn das Apple oder Google in der CH macht, in der CH besteuert werden.","Sentiment(polarity=0.0, subjectivity=0.0)"
"@UweSchreiner Ich ahne, was Du sagen willst und bin dafür.","Sentiment(polarity=0.0, subjectivity=0.0)"
"@UweSchreiner das wäre aber sehr schlecht für die Schweiz und ihre vielen Pharmafirmen, die dann in der Schweiz massiv weniger Steuern zahlen müssten!!","Sentiment(polarity=-0.3375, subjectivity=0.125)"
Schon wieder eine Initiative die überladen ist… chancenlos… man könnte ja mal mit den Kapitalgewinnen anfangen,"Sentiment(polarity=0.0, subjectivity=0.0)"
"@Grosi70 ne, das würde zu viele Eltern der JUSO treffen","Sentiment(polarity=0.0, subjectivity=1.0)"
@Grosi70. So wie in Österreich. Bei Aktiengewinnen wird abkassiert und bei Verlust nicht zurückbezahlt. Alle Risiken beim Aktionär und der Staatsangestellte lacht sich ins fäustchen.,"Sentiment(polarity=0.25, subjectivity=0.0)"
"Da die lieben Jusos ja noch nie gearbeitet und eigenes Geld verdient haben, machen sie halt das was sie am besten können andere arbeiten und Steuern zahlen lassen, und sich durchfüttern lassen","Sentiment(polarity=0.15000000000000002, subjectivity=0.0)"
Die Juso will die fleissigen und sparsamem die ihr Geld gut investieren um z.B für die pension gut vorbereitet zu sein bestrafen und die faulen verschwenderischen belohnen. Unfassbar,"Sentiment(polarity=0.27, subjectivity=0.0)"
@Malican also sich selbst belohnen,"Sentiment(polarity=1.0, subjectivity=0.0)"
@Malican also sich selbst belohnen,"Sentiment(polarity=1.0, subjectivity=0.0)"
"Die Juso- Leute sollen einmal selber Arbeiten, damit sie selber merken, wie man überhaupt Geld verdienen kann. Aber so könnt ihr alles vergessen. Das Wort ""Arbeit"" ist und bleibt für euch ein Fremdwort.","Sentiment(polarity=-0.2333333333333333, subjectivity=0.26666666666666666)"
JUSO = NEIN punkt,"Sentiment(polarity=0.0, subjectivity=0.0)"
Haben Diese Juso eigentlich auch einen Leistungsausweis? Oder nur einfach Juso sein?,"Sentiment(polarity=0.35, subjectivity=0.0)"
"@Neuernick Kurze Antwort Nein, haben sie nicht","Sentiment(polarity=0.0, subjectivity=0.0)"
"@Neuernick. Politiker kann sich jeder nennen. Sit nicht geschützt und braucht weder Kenntnise, Lehre, noch Schul schluss.","Sentiment(polarity=-0.11666666666666665, subjectivity=0.0)"
"Langsam wird's unerträglich. Diese elende ich-ich-ich-Philosophie. Die Besserverdiener sind nicht automatisch einfach reich. Sie arbeiten meist hart dafür, zahlen eine langjährige Ausbildung bis nach 30, bauen oder kaufen ein Haus und müssen das dann gleich doppelt bezahlen, denn man muss den Eigenmietwert versteuern. Das nur ein Beispiel. Wir finanzieren die sozial Schwächeren eh schon mit Sozialamt, Ergänzungsleistungen, Krankenkassenprämien, höheren Steuern und und und. Hab' keine Lust, hier alles aufzuzählen. Soweit so gut, aber es sind immer Dieselben, die immer nur mehr wollen, wollen und fordern, aber selber nix bringen.","Sentiment(polarity=-0.14166666666666666, subjectivity=0.0625)"
"@Loxx und denkt nicht, dass wenn einige mehr zahlen, ihr dann weniger zahlt","Sentiment(polarity=0.0, subjectivity=1.0)"
"Erst mal den RentenbetrugDiebstahl bei doppelt verdienenden Ehepaaren abschaffen. Bis dahin NEIN zu allen Vorlagen. Ich habe die Nase voll davon, immer für andere zu bezahlen und am Schluss der Gelackmaierte zu sein.","Sentiment(polarity=-0.3333333333333333, subjectivity=0.0)"
@Marten und die Ehepaarsteuer auch,"Sentiment(polarity=0.0, subjectivity=0.0)"
"@Grosi70 und die höhere Progression auch, und den Eigenmietwert auch, und…","Sentiment(polarity=0.0, subjectivity=0.0)"
"Bin absolut dafür, aber da von der Juso NEIN","Sentiment(polarity=0.7, subjectivity=0.0)"
"@Bronsohn. Das Stimmverhalten auf den Parteinamen zu beschränken, ist beschränkt. Leider ist aus der SP Ecke bereits seit etlichen Jahren nichts sinnvolles gekommen, und von den Juso mag ich mich nicht an etwas erinnern.","Sentiment(polarity=-0.05000000000000001, subjectivity=0.0)"
Nimmt die JUSO eigentlich irgend jemand ernst?,"Sentiment(polarity=0.0, subjectivity=0.0)"
"Bundesrat ist dagegen... Ok...nehme an... Fertig lustig... ""Ha ke Luscht"" me uf solche Regierung...nun wird immer Gegenteil abgestimmt.","Sentiment(polarity=0.5, subjectivity=0.0)"
@FreeWorld Wie erwachsen!,"Sentiment(polarity=0.0, subjectivity=0.0)"
Die JUSO will wohl jede Pensionskasse bodigen?,"Sentiment(polarity=0.0, subjectivity=0.0)"
@Samas Es geht bei der Initiative nur um natürliche Personen. Die Pensionskasse ist also davon gar nicht betroffen.,"Sentiment(polarity=0.0, subjectivity=0.4)"
"@Hoel Weisst Du eigentlich, wem das Geld der Pensionskassen gehört ( welches für exorbitante Gehälter verschwendet wird ) ?","Sentiment(polarity=0.0, subjectivity=0.0)"
@Samas eines muss man den Sozis lassen ohne sie gäbe es überhaupt keine Pensionskasse.,"Sentiment(polarity=0.0, subjectivity=0.8)"
Alles schön und gut aber die Auswirkungen auf die Wirtschaft und den SMI wären zu gross… Bitte Nicht Juso,"Sentiment(polarity=1.0, subjectivity=0.0)"
was für eine weltfremde partei!,"Sentiment(polarity=0.0, subjectivity=0.0)"
"Initiative von der Juso, da muss ich nichtmal den Initiativtext lesen um mir eine Meinung zu bilden. Die sollen zuerst mal arbeiten und nicht weiter unsere Steuergelder abkassieren.","Sentiment(polarity=0.0, subjectivity=0.0)"
"@Apy Grundsätzlich bin ich der Meinung, dass man mit dem Stimmrecht auch eine Verantwortung hat und nicht etwas annehmen oder ablehnen sollte, weil es von einer bestimmten Partei kommt. Allerdings kann ich mich an keine Vorlage der Juso erinnern, bei der ich mir nicht an den Kopf fassen musste.","Sentiment(polarity=-0.425, subjectivity=0.0)"
@el_perro. Meine Worte. Danke.,"Sentiment(polarity=0.0, subjectivity=0.0)"
"Ich denke, dass ich nicht dafür bin.","Sentiment(polarity=0.0, subjectivity=0.0)"
Was von der juso kommt ist generell abzulehnen.,"Sentiment(polarity=0.0, subjectivity=0.0)"
"Wie bei jeder Initiative, SVP sagt Wohlstand ist bedroht und alle "" Oh Nein Hilfe, ich muss sofort tun was die SVP will"". Jedes mal das gleiche, ist sowohl lustig wie auch traurig zum anschauen.","Sentiment(polarity=0.0, subjectivity=0.0)"
Ich empfehle die Börsengewinn und Kryptowährungssteuer!! Das sind gerechte Steuern! 🤔,"Sentiment(polarity=-0.2333333333333333, subjectivity=0.0)"
"Klartext bei 20 min wie immer unerwünscht, es lebt sich eben gut „Van den anderen.“","Sentiment(polarity=0.15000000000000002, subjectivity=0.0)"
"Seit Covid-Massnahmen werde ich JEDE Abstimmung wie folgt abhandeln Schauen was Bundesrat will, dann das Gegenteil einwerfen. Wird so bleiben bis Massnahmen fallen.","Sentiment(polarity=0.35, subjectivity=0.0)"
"In der aktuellen Fassung leider nicht brauchbar und extrem Wirtschaftsschädlich. Gerade gegenüber Startups und Enterpreneuren, was in der Regel diejenigen sind die der etablierten Ordnung der Superreichen ans Bein pinkeln und wirtschaftliche wie gesellschaftliche Veränderungen vorantreiben. Der Freibetrag ist viel zu niedrig und wiederinvestierte Einnahmen sollten davon ausgenommen werden. Es ist jetzt schon ein Risenchrampf in der CH ein Startup zu gründen und zum Erfolg zu bringen. Kommt jetzt diese Sozisteuer noch dazu, wird es ganz und gar unatraktiv.","Sentiment(polarity=-0.2, subjectivity=0.16)"
"Da braucht es keine Kampagne, die JUSO nimmt keiner ernst. Zumindest keiner der denken kann.","Sentiment(polarity=0.0, subjectivity=0.0)"
Initiativen von der Juso müssen jederzeit abgelehnt werden. Jemand muss in der CH noch arbeiten und Unternehmerin sein.,"Sentiment(polarity=-0.5, subjectivity=0.0)"
"Na ja, wenn ich mal ganz einfache Hirnzellen aktiviere stelle ich fest, Dass jeder einzelne in diesem Land von wohlhabenden profitiert. 1. Sie schaffen Arbeitsplätze und geben uns Jobs 2. Sie bezahlen den grössten Teil der Steuern 3. Viele unterstützen freiwillig div. Institutionen 4. Das Gros der vermögenden sind stille Schaffer, die, wie erwähnt einem grossen Teil unserer Gesellschaft Arbeitsplätze zur Verfügung stellen. 5. Würde man das gesamte Vermögen auf alle Menschen aufteilen, was würde passieren? Viele würde damit nicht umgehen können, das Geld selbstsüchtig und egoistisch verprassen. Einige gingen vernünftig damit um. Einige gingen klever damit um und würden Firmen gründen, Arbeitsplätze schaffen und mehr aus ihrem Grld machen - Quintessenz in einigen Jahren ist alles beim Alten. Habt ihr was bemerkt!!!?? Und wir gesagt, es ist eine mehr als einfache Regel. Also es gibt nichts dümmeres als die Hand zu beissen","Sentiment(polarity=-0.0011111111111110998, subjectivity=0.12222222222222222)"
Heutzutage kommt man sowieso nur noch dank der geringen Kapitalgewinnsteuern aus der Armutsspirale raus. Ansonsten ist fast jeder von uns in 1-4 Jahren Arbeitslosigkeit bankrott. Als junge Person werde ich mir die Dekaden von Zinseszinsen beziehungsweise kumulativen Wachstum nicht nehmen lassen.,"Sentiment(polarity=-0.4666666666666666, subjectivity=0.0)"
"Ich hab mich extra registriert um euch zu bitten ein JA einzuwerfen. Bitte nicht immer nachplappern was der Bundesrat möchte. Wir, das Volk, müssen auch mal auf uns schauen, und uns gehts definitiv besser wenn die Initiative angenommen wird. Klar wird jetzt Angst gemacht, aber schaut mal von wem, genau von den Reichen und Mächtigen. Zeigt dem Bundesrat dass genug ist und endlich Fair besteuert werden soll. Es kann ja nicht sein dass man als Mittelständiger kaum das Geld für die Steuern zusammen kriegt, und andere sich 5 Jachten kaufen.","Sentiment(polarity=0.513888888888889, subjectivity=0.05555555555555555)"
@CPali wenn sie unglücklich sind mit ihrem beruf und ihrer stelle sollten sie schauen wie sie ihre situation verbessern könnten. vielleicht mit einem stellenwechsel?,"Sentiment(polarity=-0.07500000000000001, subjectivity=0.0)"
"@CPali, Wer unter dem Jahr spart kann ende Jahr seine Steuern ohne Probleme bezahlen. Aber ""Mittelständige"" leben halt oft über ihre Verhältnisse.! Dazu gehören Anscheinend auch sie.","Sentiment(polarity=-0.2833333333333333, subjectivity=0.0)"
"@CPali, Wer unter dem Jahr spart kann ende Jahr seine Steuern ohne Probleme bezahlen. Aber ""Mittelständige"" leben halt oft über ihre Verhältnisse.! Dazu gehören Anscheinend auch sie.","Sentiment(polarity=-0.2833333333333333, subjectivity=0.0)"
@CPali Genau das ist so…Also geht an die Urne und legt ein Ja ein…,"Sentiment(polarity=0.0, subjectivity=0.0)"
@CPali Und genau deswegen sage ich Nein. Diese Initiative wird uns noch teuer zu stehen kommen vorallem für den Mittelstand.,"Sentiment(polarity=0.0, subjectivity=0.0)"
"@beatbachmann Ich verdiene genug und hab einen schönen Job ) bezahle auch 2 Löhne Steuern. Aber ich weiss das wir als Menschheit immer besser fahren wenn wir zusammen halten und nicht jeder egoistisch versucht möglichst viel schotter anzusammeln. Falls ihnen das nicht bewusst ist, keiner von uns kann sein Geld mit ins Grab nehmen. Also wiso nicht mit denen Teilen die kein so schönes Leben haben wie wir. Ist doch das selbe Prinzip wie die Krankenkasse. Ich bezahle immer brav und hab noch nie einen Franken daraus gebraucht. Für mich ist es völlig normal das man einander unterstützt und wiso sollen nun die reichen nicht ein wenig zu den Leuten schauen die sie reich gemacht haben.","Sentiment(polarity=0.28928571428571426, subjectivity=0.10714285714285714)"
"@CPali naja viel Hirnzälle sin für so e Ussag nid agsträngt worde Dass jeder einzelne in diesem Land von wohlhabenden profitiert. 1. Sie schaffen Arbeitsplätze und geben uns Jobs 2. Sie bezahlen den grössten Teil der Steuern 3. Viele unterstützen freiwillig div. Institutionen 4. Das Gros der vermögenden sind stille Schaffer, die, wie erwähnt einem grossen Teil unserer Gesellschaft Arbeitsplätze zur Verfügung stellen. 5. Würde man das gesamte Vermögen auf alle Menschen aufteilen, was würde passieren? Viele würde damit nicht umgehen können, das Geld selbstsüchtig und egoistisch verprassen. Einige gingen vernünftig damit um. Einige gingen klever damit um und würden Firmen gründen, Arbeitsplätze schaffen und mehr aus ihrem Grld machen - Quintessenz in einigen Jahren ist alles beim Alten. Habt ihr was bemerkt!!!?? Und wir gesagt, es ist eine mehr als einfache Regel. Also es gibt nichts dümmeres als die Hand zu beissen","Sentiment(polarity=0.04555555555555556, subjectivity=0.18888888888888886)"
@Edely Gibt jemand aus dem Mittelstand sowas von sich!!???,"Sentiment(polarity=0.0, subjectivity=0.0)"
"@CPali Ganz einfach, wenn sie recht hätten, könnten wir alle Reichen aus der Schweiz entfernen und dann hätten alle anderen mehr Geld. Wenn nicht, ist es so, dass alle anderen vom Geld dieser profitieren. Was glauben sie ist wahr ?","Sentiment(polarity=0.39166666666666666, subjectivity=0.08333333333333333)"
"@Kumniddrus Die Büezer schaffen den ganzen Wohlstand, nicht die Besitzer! Vor 30 Jahren hielten die 100 reichsten Menschen der Schweiz ein Vermögen von knapp 70 Milliarden Franken, jetzt sind es ueber 700 Milliarden!!! Der Durchschnittslohn wiederum ist in der gleichen Zeit nur von 52'000 pro Jahr auf 65'000 pro Jahr gestiegen.","Sentiment(polarity=0.0, subjectivity=0.0)"
"@CPali da könnten Sie sich noch täuschen, das mit dem besser gehen meine ich.","Sentiment(polarity=-0.7, subjectivity=0.0)"
"@Kumniddrus Du bist denen also auch schon voll auf den Leim gegangen. Die allermeisten, welche von dieser Steuer betroffen wären, haben keinen Finger für Ihren Wohlstand krumm gemacht. Das Kapital wird immer schön weitervererbt. Die machen solch hohe Renditen, die eben nur mit entsprechend viel Kapital möglich sind. Davon sind dann halt 90% der Menschheit ausgeschlossen. Das hat absolut nichts mit Fleiss, Geschick oder sonstwas zu tun. Einfach Glück gehabt bei der Geburtslotterie. Aber ja, solange wir Lemminge der Meinung sind, dass wir doch gefälligst zufrieden sein sollen und wir den Kapitalisten doch sooo viel zu verdanken haben... tja, solange wird sich tatsächlich nichts ändern. Wenn alle so denken würden, würden wir ewig auf der Stelle treten. Du denkst sie stellen uns Arbeitsplätze zur Verfügung? Falsche Sichtweise Wir stellen Ihnen unsere Arbeitskraft zur Verfügung. Ohne uns hätten die nicht ihren Wohlstand. Zeit, sich ein Stück davon abzuschneiden. Das steht uns zu!","Sentiment(polarity=0.09999999999999999, subjectivity=0.14285714285714285)"
"@CPali Nicht alle plappern nach, sondern können selbständig denken. Darum kommt ein NEIN zustande bei mir. Wenn diese guten Steuerzahler weg sind, dann hoffe ich ihre Taschen in die sie dann greifen müssen, sind tief genug.","Sentiment(polarity=0.5, subjectivity=0.0)"
@CPali leider hast du weder von Volkswirtschaft noch von Betriebswirtschaft auch nur einen blassen Dunst. Bilde sich weiter und mach eine vernünftige Ausbildung. Das öffnet deine linken Äuglein.,"Sentiment(polarity=0.10000000000000002, subjectivity=0.0)"
@A.Ku Es darf sicher noch nicht abstimmen…,"Sentiment(polarity=0.7, subjectivity=0.0)"
